{
  "service": "northwind-order-service",
  "environment": "production",
  "report_generated": "2026-08-19T10:00:00Z",
  "metrics": {
    "error_rate_timeline": [
      {"timestamp": "2026-08-11T17:00:00Z", "error_rate_pct": 0.2, "p99_latency_ms": 145},
      {"timestamp": "2026-08-11T18:00:00Z", "error_rate_pct": 1.8, "p99_latency_ms": 380},
      {"timestamp": "2026-08-11T19:00:00Z", "error_rate_pct": 2.1, "p99_latency_ms": 420},
      {"timestamp": "2026-08-11T22:00:00Z", "error_rate_pct": 1.4, "p99_latency_ms": 310},
      {"timestamp": "2026-08-11T23:45:00Z", "error_rate_pct": 3.2, "p99_latency_ms": 890},
      {"timestamp": "2026-08-12T02:00:00Z", "error_rate_pct": 4.1, "p99_latency_ms": 1200},
      {"timestamp": "2026-08-12T06:00:00Z", "error_rate_pct": 5.8, "p99_latency_ms": 2100},
      {"timestamp": "2026-08-12T12:00:00Z", "error_rate_pct": 12.3, "p99_latency_ms": 4400},
      {"timestamp": "2026-08-12T14:00:00Z", "error_rate_pct": 34.1, "p99_latency_ms": 9800},
      {"timestamp": "2026-08-12T15:00:00Z", "error_rate_pct": 18.5, "p99_latency_ms": 6200},
      {"timestamp": "2026-08-13T00:00:00Z", "error_rate_pct": 8.2, "p99_latency_ms": 3100},
      {"timestamp": "2026-08-13T23:00:00Z", "error_rate_pct": 9.1, "p99_latency_ms": 3800},
      {"timestamp": "2026-08-14T01:00:00Z", "error_rate_pct": 41.7, "p99_latency_ms": 12000},
      {"timestamp": "2026-08-14T06:00:00Z", "error_rate_pct": 52.3, "p99_latency_ms": 15000},
      {"timestamp": "2026-08-14T14:00:00Z", "error_rate_pct": 49.8, "p99_latency_ms": 14500},
      {"timestamp": "2026-08-14T16:00:00Z", "error_rate_pct": 3.2, "p99_latency_ms": 180},
      {"timestamp": "2026-08-14T17:00:00Z", "error_rate_pct": 0.3, "p99_latency_ms": 142},
      {"timestamp": "2026-08-19T08:00:00Z", "error_rate_pct": 1.1, "p99_latency_ms": 290},
      {"timestamp": "2026-08-19T09:00:00Z", "error_rate_pct": 1.4, "p99_latency_ms": 320}
    ],
    "db_connection_pool": {
      "max_connections": 200,
      "peak_active_connections": 200,
      "peak_time": "2026-08-14T06:00:00Z",
      "connection_wait_timeouts": 1847
    },
    "affected_endpoints": [
      {"endpoint": "POST /api/orders", "error_count": 3421, "error_type": "504 Gateway Timeout"},
      {"endpoint": "GET /api/orders/{id}/status", "error_count": 8892, "error_type": "504 Gateway Timeout"},
      {"endpoint": "PUT /api/orders/{id}/confirm", "error_count": 412, "error_type": "503 Service Unavailable"}
    ],
    "first_anomaly_detected": "2026-08-11T18:00:00Z",
    "peak_impact_time": "2026-08-14T06:00:00Z",
    "mitigation_time": "2026-08-14T16:00:00Z",
    "current_status": "degraded",
    "stuck_orders_count": 31
  },
  "alerts_fired": [
    {"alert": "ErrorRateHigh", "fired_at": "2026-08-12T14:05:00Z", "threshold": "30%"},
    {"alert": "DBConnectionPoolSaturated", "fired_at": "2026-08-12T14:08:00Z", "threshold": "95%"},
    {"alert": "P99LatencyHigh", "fired_at": "2026-08-12T14:05:00Z", "threshold": "5000ms"},
    {"alert": "ErrorRateHigh", "fired_at": "2026-08-14T01:10:00Z", "threshold": "30%"}
  ]
}
